{
  "$schema": "http://json-schema.org/draft-07/schema#",
  "title": "Path",
  "type": "object",
  "additionalProperties": false,
  "required": [
    "id",
    "title",
    "tagline",
    "description",
    "outcome",
    "audience",
    "lessons",
    "status"
  ],
  "properties": {
    "id": {
      "type": "string",
      "pattern": "^p-[a-z0-9-]+$"
    },
    "title": {
      "type": "string",
      "minLength": 1
    },
    "tagline": {
      "type": "string",
      "minLength": 1
    },
    "description": {
      "type": "string",
      "minLength": 1
    },
    "outcome": {
      "type": "string",
      "minLength": 1
    },
    "audience": {
      "type": "string",
      "minLength": 1
    },
    "lessons": {
      "type": "array",
      "minItems": 1,
      "items": {
        "type": "object",
        "additionalProperties": false,
        "required": [
          "lesson",
          "requires"
        ],
        "properties": {
          "lesson": {
            "type": "string",
            "pattern": "^l-[a-z0-9-]+$"
          },
          "requires": {
            "type": "array",
            "uniqueItems": true,
            "items": {
              "type": "string",
              "pattern": "^l-[a-z0-9-]+$"
            }
          }
        }
      }
    },
    "status": {
      "type": "string",
      "enum": [
        "draft",
        "authored",
        "reviewed",
        "published"
      ]
    }
  }
}
